{
  "$schema": "../schemas/weapon.schema.json",
  "id": "dagger",
  "name": "Dagger",
  "description": "A short double-edged blade. Fast but limited reach. Effective at piercing gaps in armor.",
  "material_id": "iron",
  "quality": "standard",
  "reach_class": "short",
  "damage_type": "pierce",
  "swing_momentum": 4,
  "thrust_momentum": 7,
  "attack_speed": 1.5,
  "stamina_cost": 0.08,
  "min_skill": 0,
  "two_handed": false,
  "tags": ["common", "concealable"],
  "weight_kg": 0.4,
  "value_coin": 5
}
